{
  "name": "{{cookiecutter.project_name}}",
  "version": "{{cookiecutter.plugin_version}}",
  "schema_version": "v2",
  "manifest_version": "v2",
  "compatibility": {
    "min_inclusive": "{{cookiecutter.cli_min}}",
    "max_exclusive": "{{cookiecutter.cli_max}}"
  },
  "namespace": "{{cookiecutter.plugin_namespace}}",
  "kind": "external-exec",
  "aliases": [],
  "entrypoint": "plugin-entrypoint",
  "capabilities": [],
  "trust_class": "community"
}
